{
  "captured_at": "2026-07-28T10:11:23.310807+00:00",
  "environment_id": "bbf-environment-20260728T101123Z",
  "limitations": [
    "This inventory is a host snapshot, not an apt repository snapshot or container digest.",
    "PX4 host-wide discovery is unverified; only managed or explicit paths are inspected.",
    "MicroXRCEAgent is never executed by this verifier."
  ],
  "platform": {
    "architecture": {
      "command": [
        "uname",
        "-m"
      ],
      "exit_code": 0,
      "name": "architecture",
      "reason": "",
      "required_for": [
        "dds-only-build"
      ],
      "requirement": "required",
      "status": "present",
      "stderr": "",
      "stdout": "aarch64\n",
      "version": "aarch64"
    },
    "kernel": {
      "command": [
        "uname",
        "-r"
      ],
      "exit_code": 0,
      "name": "kernel",
      "reason": "",
      "required_for": [
        "environment-identity"
      ],
      "requirement": "required",
      "status": "present",
      "stderr": "",
      "stdout": "5.10.104-tegra\n",
      "version": "5.10.104-tegra"
    },
    "os": {
      "command": [
        "cat",
        "/etc/os-release"
      ],
      "exit_code": 0,
      "name": "operating_system",
      "reason": "",
      "required_for": [
        "dds-only-build"
      ],
      "requirement": "required",
      "status": "present",
      "stderr": "",
      "stdout": "NAME=\"Ubuntu\"\nVERSION=\"20.04.6 LTS (Focal Fossa)\"\nID=ubuntu\nID_LIKE=debian\nPRETTY_NAME=\"Ubuntu 20.04.6 LTS\"\nVERSION_ID=\"20.04\"\nHOME_URL=\"https://www.ubuntu.com/\"\nSUPPORT_URL=\"https://help.ubuntu.com/\"\nBUG_REPORT_URL=\"https://bugs.launchpad.net/ubuntu/\"\nPRIVACY_POLICY_URL=\"https://www.ubuntu.com/legal/terms-and-policies/privacy-policy\"\nVERSION_CODENAME=focal\nUBUNTU_CODENAME=focal\n",
      "version": "Ubuntu 20.04.6 LTS"
    }
  },
  "px4_source": {
    "host_search_reason": "capture is intentionally bounded to managed or explicitly supplied paths",
    "host_search_status": "unverified",
    "managed_workspace": {
      "command": [
        "managed-directory-scan",
        "/home/c/px4_ws/BoomBoomFly_onboard_20260728/PX4-Autopilot",
        "/home/c/px4_ws/BoomBoomFly_onboard_20260728/src/PX4-Autopilot"
      ],
      "exit_code": 1,
      "name": "PX4-Autopilot source",
      "reason": "PX4 source is absent from the managed workspace candidates",
      "required_for": [
        "BBF-NEXT-T02"
      ],
      "requirement": "required",
      "status": "missing",
      "stderr": "no managed PX4-Autopilot directory found",
      "stdout": "",
      "version": null
    },
    "submodules": {
      "command": [
        "git",
        "-C",
        "<PX4_SOURCE>",
        "submodule",
        "status",
        "--recursive"
      ],
      "exit_code": 1,
      "name": "PX4 recursive submodules",
      "reason": "submodule state cannot be checked without PX4 source",
      "required_for": [
        "BBF-NEXT-T02"
      ],
      "requirement": "required",
      "status": "unverified",
      "stderr": "PX4 source is missing",
      "stdout": "",
      "version": null
    }
  },
  "repository": {
    "branch": "(detached)",
    "head": "1608a293a5c4aac94919bae81174ed8ad0d81276",
    "origin": "https://github.com/BoomBoomFly/BoomBoomFly.git"
  },
  "ros": {
    "distribution": {
      "command": [
        "printenv",
        "ROS_DISTRO"
      ],
      "exit_code": 0,
      "name": "ROS_DISTRO",
      "reason": "",
      "required_for": [
        "dds-only-build"
      ],
      "requirement": "required",
      "status": "present",
      "stderr": "",
      "stdout": "foxy\n",
      "version": "foxy"
    },
    "packages": [
      {
        "command": [
          "dpkg-query",
          "-W",
          "-f=${Version}\\n",
          "ros-foxy-ros-core"
        ],
        "exit_code": 0,
        "name": "ros-foxy-ros-core",
        "reason": "",
        "required_for": [
          "dds-only-build"
        ],
        "requirement": "required",
        "status": "present",
        "stderr": "",
        "stdout": "0.9.2-1focal.20230527.090016\n",
        "version": "0.9.2-1focal.20230527.090016"
      },
      {
        "command": [
          "dpkg-query",
          "-W",
          "-f=${Version}\\n",
          "ros-foxy-ros-base"
        ],
        "exit_code": 0,
        "name": "ros-foxy-ros-base",
        "reason": "",
        "required_for": [
          "dds-only-build"
        ],
        "requirement": "required",
        "status": "present",
        "stderr": "",
        "stdout": "0.9.2-1focal.20230606.043331\n",
        "version": "0.9.2-1focal.20230606.043331"
      },
      {
        "command": [
          "dpkg-query",
          "-W",
          "-f=${Version}\\n",
          "ros-foxy-rclcpp"
        ],
        "exit_code": 0,
        "name": "ros-foxy-rclcpp",
        "reason": "",
        "required_for": [
          "dds-only-build"
        ],
        "requirement": "required",
        "status": "present",
        "stderr": "",
        "stdout": "2.4.3-1focal.20230527.072753\n",
        "version": "2.4.3-1focal.20230527.072753"
      },
      {
        "command": [
          "dpkg-query",
          "-W",
          "-f=${Version}\\n",
          "ros-foxy-rmw-fastrtps-cpp"
        ],
        "exit_code": 0,
        "name": "ros-foxy-rmw-fastrtps-cpp",
        "reason": "",
        "required_for": [
          "dds-only-build"
        ],
        "requirement": "required",
        "status": "present",
        "stderr": "",
        "stdout": "1.3.2-1focal.20230527.064419\n",
        "version": "1.3.2-1focal.20230527.064419"
      }
    ]
  },
  "schema_version": "1.0.0",
  "tools": [
    {
      "command": [
        "/usr/bin/python3",
        "--version"
      ],
      "exit_code": 0,
      "name": "python3",
      "reason": "",
      "required_for": [
        "wave1-validation"
      ],
      "requirement": "required",
      "status": "present",
      "stderr": "",
      "stdout": "Python 3.8.10\n",
      "version": "Python 3.8.10"
    },
    {
      "command": [
        "git",
        "--version"
      ],
      "exit_code": 0,
      "name": "git",
      "reason": "",
      "required_for": [
        "workspace-restore"
      ],
      "requirement": "required",
      "status": "present",
      "stderr": "",
      "stdout": "git version 2.25.1\n",
      "version": "git version 2.25.1"
    },
    {
      "command": [
        "/usr/bin/python3",
        "-c",
        "import importlib.metadata as m; print(m.version('colcon-core'))"
      ],
      "exit_code": 0,
      "name": "colcon",
      "reason": "",
      "required_for": [
        "dds-only-build"
      ],
      "requirement": "required",
      "status": "present",
      "stderr": "",
      "stdout": "0.21.0\n",
      "version": "0.21.0"
    },
    {
      "command": [
        "cmake",
        "--version"
      ],
      "exit_code": 0,
      "name": "cmake",
      "reason": "",
      "required_for": [
        "dds-only-build"
      ],
      "requirement": "required",
      "status": "present",
      "stderr": "",
      "stdout": "cmake version 3.16.3\n\nCMake suite maintained and supported by Kitware (kitware.com/cmake).\n",
      "version": "cmake version 3.16.3"
    },
    {
      "command": [
        "ninja",
        "--version"
      ],
      "exit_code": 0,
      "name": "ninja",
      "reason": "",
      "required_for": [
        "BBF-NEXT-T02"
      ],
      "requirement": "optional",
      "status": "present",
      "stderr": "",
      "stdout": "1.11.1.git.kitware.jobserver-1\n",
      "version": "1.11.1.git.kitware.jobserver-1"
    },
    {
      "command": [
        "gcc",
        "-dumpfullversion"
      ],
      "exit_code": 0,
      "name": "gcc",
      "reason": "",
      "required_for": [
        "dds-only-build"
      ],
      "requirement": "required",
      "status": "present",
      "stderr": "",
      "stdout": "9.4.0\n",
      "version": "9.4.0"
    },
    {
      "command": [
        "g++",
        "-dumpfullversion"
      ],
      "exit_code": 0,
      "name": "g++",
      "reason": "",
      "required_for": [
        "dds-only-build"
      ],
      "requirement": "required",
      "status": "present",
      "stderr": "",
      "stdout": "9.4.0\n",
      "version": "9.4.0"
    },
    {
      "command": [
        "arm-none-eabi-gcc",
        "--version"
      ],
      "exit_code": 127,
      "name": "arm-none-eabi-gcc",
      "reason": "tool or exact version output is unavailable",
      "required_for": [
        "BBF-NEXT-T02"
      ],
      "requirement": "required",
      "status": "missing",
      "stderr": "[Errno 2] No such file or directory: 'arm-none-eabi-gcc'",
      "stdout": "",
      "version": null
    },
    {
      "command": [
        "arm-none-eabi-g++",
        "--version"
      ],
      "exit_code": 127,
      "name": "arm-none-eabi-g++",
      "reason": "tool or exact version output is unavailable",
      "required_for": [
        "BBF-NEXT-T02"
      ],
      "requirement": "required",
      "status": "missing",
      "stderr": "[Errno 2] No such file or directory: 'arm-none-eabi-g++'",
      "stdout": "",
      "version": null
    },
    {
      "command": [
        "which",
        "MicroXRCEAgent"
      ],
      "exit_code": 1,
      "name": "MicroXRCEAgent",
      "reason": "binary is absent from PATH; it was not executed",
      "required_for": [
        "BBF-NEXT-T02"
      ],
      "requirement": "required",
      "status": "missing",
      "stderr": "",
      "stdout": "",
      "version": null
    }
  ]
}
