{
  "schema_version": "1.0.0",
  "environment_id": "bbf-environment-orin-nano-20260726t175316+0800",
  "captured_at": "2026-07-26T17:53:16+08:00",
  "repository": {
    "origin": "https://github.com/BoomBoomFly/BoomBoomFly.git",
    "branch": "agent/wave1-environment",
    "head": "5a0e6edd4930474506a1046d414425893ebd800f"
  },
  "platform": {
    "os": {
      "name": "operating_system",
      "requirement": "required",
      "required_for": ["dds-only-build"],
      "status": "present",
      "version": "Ubuntu 20.04.6 LTS",
      "command": ["cat", "/etc/os-release"],
      "exit_code": 0,
      "stdout": "PRETTY_NAME=\"Ubuntu 20.04.6 LTS\"\nVERSION_ID=\"20.04\"\nVERSION_CODENAME=focal\n",
      "stderr": "",
      "reason": ""
    },
    "kernel": {
      "name": "kernel",
      "requirement": "required",
      "required_for": ["environment-identity"],
      "status": "present",
      "version": "5.10.104-tegra",
      "command": ["uname", "-r"],
      "exit_code": 0,
      "stdout": "5.10.104-tegra\n",
      "stderr": "",
      "reason": ""
    },
    "architecture": {
      "name": "architecture",
      "requirement": "required",
      "required_for": ["dds-only-build"],
      "status": "present",
      "version": "aarch64",
      "command": ["uname", "-m"],
      "exit_code": 0,
      "stdout": "aarch64\n",
      "stderr": "",
      "reason": ""
    }
  },
  "ros": {
    "distribution": {
      "name": "ROS_DISTRO",
      "requirement": "required",
      "required_for": ["dds-only-build"],
      "status": "present",
      "version": "foxy",
      "command": ["printenv", "ROS_DISTRO"],
      "exit_code": 0,
      "stdout": "foxy\n",
      "stderr": "",
      "reason": ""
    },
    "packages": [
      {
        "name": "ros-foxy-ros-core",
        "requirement": "required",
        "required_for": ["dds-only-build"],
        "status": "present",
        "version": "0.9.2-1focal.20230527.090016",
        "command": ["dpkg-query", "-W", "ros-foxy-ros-core"],
        "exit_code": 0,
        "stdout": "ros-foxy-ros-core 0.9.2-1focal.20230527.090016\n",
        "stderr": "",
        "reason": ""
      },
      {
        "name": "ros-foxy-ros-base",
        "requirement": "required",
        "required_for": ["dds-only-build"],
        "status": "present",
        "version": "0.9.2-1focal.20230606.043331",
        "command": ["dpkg-query", "-W", "ros-foxy-ros-base"],
        "exit_code": 0,
        "stdout": "ros-foxy-ros-base 0.9.2-1focal.20230606.043331\n",
        "stderr": "",
        "reason": ""
      },
      {
        "name": "ros-foxy-rclcpp",
        "requirement": "required",
        "required_for": ["dds-only-build"],
        "status": "present",
        "version": "2.4.3-1focal.20230527.072753",
        "command": ["dpkg-query", "-W", "ros-foxy-rclcpp"],
        "exit_code": 0,
        "stdout": "ros-foxy-rclcpp 2.4.3-1focal.20230527.072753\n",
        "stderr": "",
        "reason": ""
      },
      {
        "name": "ros-foxy-rmw-fastrtps-cpp",
        "requirement": "required",
        "required_for": ["dds-only-build"],
        "status": "present",
        "version": "1.3.2-1focal.20230527.064419",
        "command": ["dpkg-query", "-W", "ros-foxy-rmw-fastrtps-cpp"],
        "exit_code": 0,
        "stdout": "ros-foxy-rmw-fastrtps-cpp 1.3.2-1focal.20230527.064419\n",
        "stderr": "",
        "reason": ""
      }
    ]
  },
  "tools": [
    {
      "name": "python3",
      "requirement": "required",
      "required_for": ["wave1-validation"],
      "status": "present",
      "version": "Python 3.8.10",
      "command": ["python3", "--version"],
      "exit_code": 0,
      "stdout": "Python 3.8.10\n",
      "stderr": "",
      "reason": ""
    },
    {
      "name": "git",
      "requirement": "required",
      "required_for": ["workspace-restore"],
      "status": "present",
      "version": "git version 2.25.1",
      "command": ["git", "--version"],
      "exit_code": 0,
      "stdout": "git version 2.25.1\n",
      "stderr": "",
      "reason": ""
    },
    {
      "name": "colcon",
      "requirement": "required",
      "required_for": ["dds-only-build"],
      "status": "present",
      "version": "0.21.0",
      "command": ["python3", "-c", "import importlib.metadata as m; print(m.version('colcon-core'))"],
      "exit_code": 0,
      "stdout": "0.21.0\n",
      "stderr": "",
      "reason": ""
    },
    {
      "name": "cmake",
      "requirement": "required",
      "required_for": ["dds-only-build"],
      "status": "present",
      "version": "cmake version 3.16.3",
      "command": ["cmake", "--version"],
      "exit_code": 0,
      "stdout": "cmake version 3.16.3\n",
      "stderr": "",
      "reason": ""
    },
    {
      "name": "ninja",
      "requirement": "optional",
      "required_for": ["BBF-NEXT-T02"],
      "status": "present",
      "version": "1.11.1.git.kitware.jobserver-1",
      "command": ["ninja", "--version"],
      "exit_code": 0,
      "stdout": "1.11.1.git.kitware.jobserver-1\n",
      "stderr": "",
      "reason": ""
    },
    {
      "name": "gcc",
      "requirement": "required",
      "required_for": ["dds-only-build"],
      "status": "present",
      "version": "9.4.0",
      "command": ["gcc", "-dumpfullversion"],
      "exit_code": 0,
      "stdout": "9.4.0\n",
      "stderr": "",
      "reason": ""
    },
    {
      "name": "g++",
      "requirement": "required",
      "required_for": ["dds-only-build"],
      "status": "present",
      "version": "9.4.0",
      "command": ["g++", "-dumpfullversion"],
      "exit_code": 0,
      "stdout": "9.4.0\n",
      "stderr": "",
      "reason": ""
    },
    {
      "name": "arm-none-eabi-gcc",
      "requirement": "required",
      "required_for": ["BBF-NEXT-T02"],
      "status": "missing",
      "version": null,
      "command": ["command", "-v", "arm-none-eabi-gcc"],
      "exit_code": 1,
      "stdout": "",
      "stderr": "",
      "reason": "cross compiler is absent from PATH"
    },
    {
      "name": "arm-none-eabi-g++",
      "requirement": "required",
      "required_for": ["BBF-NEXT-T02"],
      "status": "missing",
      "version": null,
      "command": ["command", "-v", "arm-none-eabi-g++"],
      "exit_code": 1,
      "stdout": "",
      "stderr": "",
      "reason": "cross compiler is absent from PATH"
    },
    {
      "name": "MicroXRCEAgent",
      "requirement": "required",
      "required_for": ["BBF-NEXT-T02"],
      "status": "missing",
      "version": null,
      "command": ["command", "-v", "MicroXRCEAgent"],
      "exit_code": 1,
      "stdout": "",
      "stderr": "",
      "reason": "binary is absent from PATH and was not executed"
    }
  ],
  "px4_source": {
    "managed_workspace": {
      "name": "PX4-Autopilot source",
      "requirement": "required",
      "required_for": ["BBF-NEXT-T02"],
      "status": "missing",
      "version": null,
      "command": ["managed-directory-scan", "PX4-Autopilot", "src/PX4-Autopilot", "../PX4-Autopilot"],
      "exit_code": 1,
      "stdout": "",
      "stderr": "no managed PX4-Autopilot directory found",
      "reason": "PX4 source is absent from the managed workspace candidates"
    },
    "host_search_status": "unverified",
    "host_search_reason": "A bounded host search was incomplete because one /opt path was unreadable; no matching source was reported, but host-wide absence is not proven.",
    "submodules": {
      "name": "PX4 recursive submodules",
      "requirement": "required",
      "required_for": ["BBF-NEXT-T02"],
      "status": "unverified",
      "version": null,
      "command": ["git", "-C", "<PX4_SOURCE>", "submodule", "status", "--recursive"],
      "exit_code": 1,
      "stdout": "",
      "stderr": "PX4 source is missing",
      "reason": "submodule state cannot be checked without PX4 source"
    }
  },
  "limitations": [
    "This is a host snapshot, not an apt repository snapshot, rosdep resolution lock, or container digest.",
    "PX4 source absence is proven only for managed workspace candidates; the host-wide result is unverified.",
    "MicroXRCEAgent was not executed, and no hardware or device path was accessed.",
    "The Ninja version identifies the binary but not an immutable package repository."
  ]
}
